{
  "$schema": "vector-provenance-v1.schema.json",
  "schema_version": 1,
  "claim_policy": "requirements-not-evidence",
  "canonical_hash_rules": {
    "id": "veyora-vector-json-v1",
    "fixture_sha256": "SHA-256 of UTF-8 JSON for one fixture/vector after removing only fixture_sha256, sorting object keys lexicographically at every depth, emitting no insignificant whitespace, preserving array order, and rejecting floats, NaN, Infinity, and duplicate object names",
    "source_sha256": "SHA-256 of the exact raw generator source file bytes; committed-file references resolve within the repository and must match before corpus acceptance",
    "review_artifact_sha256": "SHA-256 of the exact raw structured review-record bytes under docs/security/reviews/<corpus-id>/<fixture-id>.review-v1.json; the record names an active scoped key in the owner-authenticated out-of-band attestation registry at contracts/protocol/approved-evidence-reviewers-v1.json and signs the canonical approval preimage binding reviewer identity and qualification, disposition, corpus/fixture, generator source, review subject, canonical review output, and output hash; identity and key labels are metadata, not evidence of humanity"
  },
  "native_secretstream_source": {
    "version": "1.0.22",
    "archive_url": "https://download.libsodium.org/libsodium/releases/libsodium-1.0.22-stable.tar.gz",
    "archive_filename": "libsodium-1.0.22-stable.tar.gz",
    "archive_sha256": "0dead67e534e4e14302d9f285fb68688f18ee93fb35350ac05214dd7772ab534",
    "sidecar_url": "https://download.libsodium.org/libsodium/releases/libsodium-1.0.22-stable.tar.gz.minisig",
    "sidecar_filename": "libsodium-1.0.22-stable.tar.gz.minisig",
    "sidecar_sha256": "9ed6444f7bb2a0b052d872062d398417262d544f65ee42be1df2a956469c07fe",
    "selection": "pinned-offline-sodium-dist-dir",
    "required_dist_names": ["LATEST.tar.gz", "LATEST.tar.gz.minisig"],
    "forbidden_environment": ["SODIUM_LIB_DIR", "SODIUM_USE_PKG_CONFIG", "SODIUM_SHARED", "VCPKGRS_DYNAMIC", "SODIUM_DISABLE_PIE"],
    "forbidden_features": ["fetch-latest", "minimal", "optimized", "use-pkg-config"],
    "cargo_mode": "locked-offline-network-denied",
    "supported_targets": ["linux", "macos", "windows"],
    "excluded_targets": ["wasm32-unknown-unknown", "android"],
    "license": "ISC-human-review-required",
    "human_disposition": "required-not-recorded"
  },
  "corpora": {
    "project-crypto-v1": {
      "id": "project-crypto-v1",
      "planned_path": "packages/security-kernel/vectors/v1.json",
      "schema_path": "contracts/protocol/crypto-vector-corpus-v1.schema.json",
      "status": "present-validated",
      "generator_owner_policy": "closed-independent-only",
      "committed_oracle_path": "packages/security-kernel/oracles/project-crypto-v1.py",
      "source_section_required": true,
      "independent_inputs_required": true,
      "expected_bytes_required": true,
      "intermediates_required": true,
      "oracle_source": "dependency-free-independent-reference-oracle-outside-product-code",
      "fixed_decrypt_oracle": "not-applicable",
      "live_encrypt_oracle": "not-applicable",
      "existing_goldens_scope": "not-applicable",
      "required_shapes": ["argon2id", "hkdf-sha256", "xchacha20poly1305", "hpke-base-x25519", "ed25519-strict", "p256-es256", "protocol-cbor", "webauthn-cbor", "webauthn-client-json", "recovery-human-form", "session-policy", "webauthn-composite-enrollment", "unlock-wrap-buckets", "native-web-bootstrap", "authentication-contexts", "root-rotation", "signed-checkpoint", "signed-account-state-false-true", "signed-manifest-false-true"],
      "canonical_hash_rule": "veyora-vector-json-v1",
      "generator_source_sha256_status": "recorded-and-bound",
      "fixture_output_sha256_status": "recorded-and-bound",
      "review_disposition": "required-not-recorded"
    },
    "native-backup-v1": {
      "id": "native-backup-v1",
      "planned_path": "packages/security-kernel/vectors/backup-v1.json",
      "schema_path": "contracts/backup/backup-vector-corpus-v1.schema.json",
      "status": "required-not-present",
      "generator_owner_policy": "closed-independent-only",
      "committed_oracle_path": "packages/security-kernel/oracles/secretstream-v1.c",
      "source_section_required": true,
      "independent_inputs_required": true,
      "expected_bytes_required": true,
      "intermediates_required": true,
      "oracle_source": "blocked-no-libsodium-fixed-corpus-plus-exact-pynacl-capture-route",
      "fixed_decrypt_oracle": "blocked-pending-reviewed-captured-vector",
      "live_encrypt_oracle": "separate-c-checker-process",
      "existing_goldens_scope": "wire-components-only-no-secretstream-ciphertext",
      "required_shapes": ["upstream-fixed-decrypt", "empty", "one-byte", "exact-chunk", "multi-chunk"],
      "upstream_fixed_reference_status": "blocked-no-libsodium-published-fixed-secretstream-data",
      "libsodium_test_source_url": "https://raw.githubusercontent.com/jedisct1/libsodium/1.0.22-RELEASE/test/default/secretstream_xchacha20poly1305.c",
      "libsodium_test_source_sha256": "5f13b9d1cdd46a5fcff41f25472fca94b7d2d779fb95df7f008b52696ec30742",
      "libsodium_test_semantics": "randomized-roundtrip-test-not-fixed-reference-data",
      "capture_generator_url": "https://raw.githubusercontent.com/pyca/pynacl/ecf41f55a3d8f1e10ce89c61c4b4d67f3f4467cf/docs/vectors/c-source/secretstream_test_vector.c",
      "capture_generator_sha256": "911a361c92996c35f73e85e2258d848b4b43a3aba7030e4f070a0f148617e1b3",
      "capture_generator_semantics": "random-output-capture-not-deterministic-kat",
      "canonical_hash_rule": "veyora-vector-json-v1",
      "generator_source_sha256_status": "required-not-recorded",
      "fixture_output_sha256_status": "required-not-recorded",
      "review_disposition": "required-not-recorded"
    },
    "manifest-v1": {
      "id": "manifest-v1",
      "planned_path": "packages/security-kernel/vectors/manifest-v1.json",
      "schema_path": "contracts/protocol/manifest-vector-corpus-v1.schema.json",
      "status": "present-validated",
      "generator_owner_policy": "closed-independent-only",
      "committed_oracle_path": "packages/security-kernel/oracles/manifest-v1.py",
      "source_section_required": true,
      "independent_inputs_required": true,
      "expected_bytes_required": true,
      "intermediates_required": true,
      "oracle_source": "dependency-free-manifest-reference-oracle-outside-product-code",
      "fixed_decrypt_oracle": "not-applicable",
      "live_encrypt_oracle": "not-applicable",
      "existing_goldens_scope": "not-applicable",
      "required_shapes": ["empty", "one-leaf", "two-leaf", "odd-promotion", "chunk-boundary", "tombstone-live-order", "10000-live", "50000-relations"],
      "canonical_hash_rule": "veyora-vector-json-v1",
      "generator_source_sha256_status": "recorded-and-bound",
      "fixture_output_sha256_status": "recorded-and-bound",
      "review_disposition": "required-not-recorded"
    }
  }
}
